{
  "$schema": "http://json-schema.org/draft-07/schema#",
  "title": "Quick Task Index Schema",
  "description": "Schema for quick mode task index file",
  "type": "object",
  "required": ["feature", "proposal", "created", "status", "tasks"],
  "properties": {
    "feature": {
      "type": "string"
    },
    "proposal": {
      "type": "string",
      "description": "Path to the source proposal document (replaces prd + design)"
    },
    "created": {
      "type": "string",
      "format": "date"
    },
    "status": {
      "type": "string",
      "enum": ["planning", "in-progress", "completed"]
    },
    "statusEnum": {
      "type": "array",
      "items": { "type": "string" }
    },
    "priorityEnum": {
      "type": "array",
      "items": { "type": "string" }
    },
    "testCommand": {
      "type": "string",
      "description": "Shell command for running project-wide tests (overrides auto-detection)"
    },
    "e2eRound": {
      "type": "integer",
      "minimum": 0,
      "maximum": 3,
      "description": "Current fix-e2e round counter. 0 = no failures yet. Incremented each time e2e tests fail and fix tasks are appended. Max 3 rounds."
    },
    "tasks": {
      "type": "object",
      "additionalProperties": {
        "type": "object",
        "required": ["id", "title", "priority", "status", "file"],
        "properties": {
          "id": { "type": "string" },
          "title": { "type": "string" },
          "priority": { "type": "string", "enum": ["P0", "P1", "P2"] },
          "estimatedTime": { "type": "string" },
          "dependencies": {
            "type": "array",
            "items": { "type": "string" }
          },
          "status": { "type": "string", "enum": ["pending", "in_progress", "completed", "blocked", "skipped", "rejected"] },
          "file": { "type": "string" },
          "record": { "type": "string" },
          "breaking": {
            "type": "boolean",
            "description": "When true, task completion triggers full test suite across all layers",
            "default": false
          },
          "scope": {
            "type": "string",
            "enum": ["frontend", "backend", "all"],
            "default": "all",
            "description": "Task scope: must be explicitly set using the Scope Assignment algorithm. 'all' for cross-layer and T-quick tasks; 'frontend'/'backend' for single-layer tasks in mixed projects."
          },
          "mainSession": {
            "type": "boolean",
            "description": "When true, run-tasks executes this task in the main session instead of dispatching to task-executor.",
            "default": false
          }
        }
      }
    }
  }
}
